nom;prenom;numero_etudiant;poste;categorie;biographie;programme
SOMA;Ben Idriss Diloma;2025010;Président(e);Bureau exécutif;Étudiant en ISE1 Maths à l'ENSAE, Ben Idriss Diloma SOMA est reconnu pour son leadership et son esprit d'équipe. Il a organisé plusieurs événements majeurs et est reconnu pour son dévouement et sa capacité à fédérer les équipes.;Moderniser les infrastructures et améliorer le cadre de vie étudiant. Renforcer les liens avec les entreprises et faciliter l'insertion professionnelle.
BERETE;Mamady I;2025011;Président(e);Bureau exécutif;Étudiant en ISE1 Eco à l'ENSAE, Mamady I BERETE est très impliqué dans la vie associative de l'école. Il a été membre du bureau de plusieurs clubs et est reconnu pour son dévouement et sa capacité à fédérer les équipes.;Renforcer les liens avec les entreprises et faciliter l'insertion professionnelle. Développer une politique de bourses et d'aide aux étudiants en difficulté.
SARR;Aïcha;2025012;Secrétaire général(e);Bureau exécutif;Étudiante en ITS2 à l'ENSAE, Aïcha SARR est très impliquée dans la vie associative de l'école. Elle a participé à de nombreux projets collaboratifs et est reconnue pour son dévouement et sa capacité à fédérer les équipes.;Digitaliser la gestion administrative pour plus d'efficacité. Améliorer la communication interne et la transparence.
DIALLO;Moussa;2025013;Tésorier(e);Bureau exécutif;Étudiant en ISE2 à l'ENSAE, Moussa DIALLO est reconnu pour sa rigueur académique et son engagement social. Il a mené des initiatives d'amélioration de la vie étudiante et est reconnu pour son dévouement et sa capacité à fédérer les équipes.;Assurer une gestion financière transparente et rigoureuse. Développer de nouvelles sources de financement pour l'association.
KANE;Fatou;2025014;Président(e) de la Junior Entreprise (JE);Départements permanents;Étudiante en ISE1 Eco à l'ENSAE, Fatou KANE est passionnée par l'innovation et les nouvelles technologies. Elle a développé des partenariats avec des entreprises locales et est reconnue pour son dévouement et sa capacité à fédérer les équipes.;Dynamiser les activités et créer plus d'opportunités pour les étudiants. Développer des partenariats stratégiques et des projets innovants. 